date,link,headline,content,newsof
"April 8, 2018",http://archive.sharesansar.com/janata-bank-and-boom-remit-join-forces-remittance-can-now-be-received-via-combined-network-of-10k-agents-and-107-bank-branches/,Janata Bank and Boom Remit join forces; remittance can now be received via combined network of 10K agents and 107 bank branches,"Janata Bank has appointed Boom Remit Pvt Ltd as its primary agent for its Janata Remit service on Chaitra 23, 2074. The agreement for the same has been signed between CEO of the bank Mr. Parshuram Kunwor Chettri and Managing Director of the remittance company Mr. Dhirendra Pant. Following the agreement, Nepalese who send their money from abroad through Janata Remit or via Boom Remit can now received through each others’ branches and agents that are spread throughout all 77 districts of the nation. Combined, both Janata Bank and Boom Remit have a network of 10 thousand sub-agents all over the nation while Janata Bank has branch network of 107 branches. Boom remit is currently providing remittance service from gulf countries and from Hong Kong.  ","('SBL', 'NEPSE')"
"April 8, 2018",http://archive.sharesansar.com/jyoti-bikas-bank-to-provide-8-75-interest-in-jyoti-bumper-saving-account/,Jyoti Bikas Bank to provide 8.75% interest in Jyoti Bumper Saving Account,"Jyoti Bikas Bank Limited has launched a new saving product “Jyoti Bumper Saving” with an aim to provide handsome interest rate of 8.75% to its customers. Issuing the press statement, the development bank has informed that the customers would be able to receive insurance facility, special discount in foreign exchanges, free Visa Debit Card, internet banking, C-ASBA and other banking facilities with the newly launched Bumper saving account. The national level development bank is serving its customers through 50 branches and 14 ATM outlets whereas is also mulling to kick start 10 more branches in near future. the bank has deposit collection of Rs 14.16 arba and credit disbursement of 14.37 arba. Its paid up capital stands at Rs 2.59 arba. ","('JBBL', 'NEPSE')"
"April 8, 2018",http://archive.sharesansar.com/century-commercial-bank-inks-deal-of-bancassurance-with-reliance-life-insurance/,Century Commercial Bank inks deal of bancassurance with Reliance Life Insurance,"Century Commercial Bank has signed an agreement of bancassurance with Reliance Life Insurance Limited to provide the life insurance policies of the later through its branch network. The agreement was signed on Chaitra 22, 2074 between Acting CEO of the bank Mr. Jiban Bhattrai and CEO of the insurance company Mr. Prabin Raman Parajuli. Following the agreement, the customers of the commercial bank can avail all the insurance facilities being provided by the life insurance company from all its branches.The bank is providing its services through 93 branches, 8 extension counters and 10 branchless banking locations throughout the country.","('JBBL', 'NEPSE')"
"April 8, 2018",http://archive.sharesansar.com/machchapuchchre-bank-provides-infrastructure-for-clean-drinking-water-at-pancharatna-secondary-school-of-birtamod/,Machchapuchchre Bank provides infrastructure for clean drinking water at Pancharatna Secondary School of Birtamod,"Machchapuchchre Bank Limited has supported Pancharatna Secondary School at Birtamod Jhapa to construct the clean drinking water facility and other necessary infrastructures with an aim to guarantee clean water to the school children. The drinking water facility has been jointly inaugurated by Province 1 minister Hon. Jiban Ghimire and branch manager of Birtamod branch Mr. Bharat Prashai amidst a special function. The commercial bank currently has 62 branches, 4 extension counters,, 14 branchless banking facilities and 86 ATM outlets throughout the nation. ","('JBBL', 'NEPSE')"
"April 8, 2018",http://archive.sharesansar.com/sanima-life-insurance-company-expands-insurance-services-to-janakpur-and-lahan-adds-2-new-branches/,Sanima Life Insurance Company expands insurance services to Janakpur and Lahan; adds 2 new branches,"Sanima Life Insurance has formally inaugurated 2 new branches at Janakpur of Dhanusha and Lahan of Siraha districts on Chaitra 23, 2074. Issuing the press statement, the newly established life insurance company has informed that its latest facilities have been jointly inaugurated by BOD Mr. Badri Bishal Ghimire, Brand Ambassador Mr. Jitu Nepal, Managing Director Mr. Ganesh Chaulagai, BOD Ms Usha Khatiwada among others. ","('JBBL', 'NEPSE')"
"April 8, 2018",http://archive.sharesansar.com/janata-bank-celebrates-8th-anniversary-invests-back-to-society-through-range-of-csr-activities/,Janata Bank celebrates 8th anniversary; invests back to society through range of CSR activities,"Janata Bank has organized a range of programs under its Corporate Social Responsibility event to mark its 8th Anniversary. The bank has conducted financial literacy program, organized free health camp for 500 women at Chautara branch of Sindhupalchowk, blood donation camps at several branches including Bharatpur, Pokhara and so on, donated food and clothes worth of Rs 35 thousand to old age home of Damak and orphanage of Mahendranagar, provided scholarship worth of Rs 2.20 lakh to 44 students studying at different schools.The bank is currently providing facilities through 106 branches thereby raising deposits of Rs 53 arba and disbursing loans of Rs 50 arba. ","('JBBL', 'NEPSE')"
"April 8, 2018",http://archive.sharesansar.com/banks-and-insurance-companies-to-join-hands-for-commodity-exchange-paid-up-capital-to-be-rs-68-25-crore/,Banks and Insurance Companies to join hands for Commodity exchange; Paid up capital to be Rs 68.25 crore,"Altogether of 7 commercial banks, 2 development banks and 5 insurance companies have agreed to join hands for the establishment of Derivative business in Nepal.The proposed company is set to have an authorized capital of Rs 1 arba and Paid up capital of Rs 68.25 crore.Commercial banks like Sanima Bank, Janata Bank, Siddhartha Bank, Laxmi Bank, Sunrise Bank, NCC Bank and NMB Bank will be among the promoters of the company. Similarly, Mahalaxmi Bikas Bank, Excel Development Bank, Prime Life Insurance, Neco Insurance, Everest Insurance, Premier Insurance, Siddhartha Insurance, CBIL Capital, Sweda Investment and Gatisheel Investment will also be among the promoter companies.The company will be established and run under the participation of experts in the field of commodities exchange.Company under the name of Multi Derivative Exchange was the 2nd company to apply in SEBON for establishment. The company with reputed banks as the major investors is likely to receive permission for establishment without any hassle.As per the new law made for Commodities Exchange, a commodity exchange company should have a minimum paid up capital of Rs 50 crore and a promoter’s holding should not exceed by more than 5% of the total paid up capital. ","('NMB', 'NEPSE')"
"April 8, 2018",http://archive.sharesansar.com/last-day-to-secure-10-bonus-share-of-everest-insurance-company-plans-further-105-and-300-right-share-issue/,Last day to secure 10% bonus share of Everest Insurance Company; Plans further 105% and 300% right share issue,"Today is the last day to secure 10% bonus shares of Everest Insurance Company Limited as the book closure for its 23rd AGM will be tomorrow.Everest Insurance Company Limited (EIC) will be conducting its 23rd Annual General Meeting (AGM) on Baishakh 10, 2075. The AGM is going to be held at Agrawal Bhawan, Kamalpokhari, Kathmandu at 2:00 PM.The main agendas of the AGM are:To endorse 10% bonus shares from the profit of FY 2073/74 amounting Rs 1.215 crore and cash dividend of Rs 6.39 lakh (for tax purpose)To revise previously declared 600% right shares in order to maintain 51% promoters share structure as per the Directives issued by the Insurance Board.To amend the Memorandum of Association (MOA) and Articles of Association (AOA).To increase the meeting allowance of the Board of Directors.Read the AGM notice of Everest Insurance (here)","('EIC', 'NEPSE')"
"April 8, 2018",http://archive.sharesansar.com/last-day-to-place-bids-for-1-8-lakh-unit-auctioned-right-shares-of-pokhara-finance-bidders-can-apply-for-1000-units-in-promoters-group-and-100-units-in-ordinary-group/,Last Day to place bids for 1.8 lakh unit auctioned right shares of Pokhara Finance; Bidders can apply for 1000 units in promoters group and 100 units in ordinary group,"Today is the last day to place bids for the auctioned 1.8 lakh unit right shares of Pokhara Finance Company.Bidders must quote a minimum price of Rs 100 per unit, which means that the lowest bid amount must be more than Rs 100. Only the existing promoters can apply for the right shares of the promoters group. Interested bidders must bid for a minimum of 1,000 unit shares in the promoters group and 100 units in the ordinary group.The finance company had floated 9,83,682.74 unit right shares for the shareholders from Poush 30, 2074. The auction has been opened for the unsold 80,348.27 unit right shares of promoter group and 1,00,353.47 unit right shares of ordinary shareholders group.NIBL Ace Capital Limited has been appointed as the issue manager for the auction. The bidders can collect the forms from NIBL Ace Capital or from the designated branches of Pokhara Finance Limited.The finance company has urged the bidders to deposit the bid amount in A/C No 0124524617025016 in Kumari Bank Limited in the name of NIBL Ace Capital or through Good for Payment Cheque.PFL had issued 9,83,682 units FPO shares worth Rs  21.64 crore at Rs 220 per unit on Shrawan 29, 2074. After the FPO, its paid up capital reached around Rs 65.57 crore from Rs 55.74 crore. Finally, after proposed 15% right share issuance, its paid up capital will reach Rs 75.40 crore. As a national level finance company, it should hike its paid up capital to a minimum of Rs 80 crore by the end of FY 2073/74. The finance company has also announced 8.26% bonus shares from the profit of FY 2073/74. After the adjustment of right shares and bonus shares, the paid up capital of the company will reach Rs 81.63 crore. ","('KBL', 'NEPSE')"
"April 8, 2018",http://archive.sharesansar.com/nic-asia-bank-extends-helping-hands-to-8-students-from-karnali-provides-scholarships-worth-rs-2-lakh-for-their-higher-education/,NIC ASIA Bank extends helping hands to 8 students from Karnali; provides scholarships worth Rs 2 lakh for their higher education,"NICASIA Bank Limited has extended a cash support of Rs 2 lakh as a scholarship grant to 8 students from Karnali province. The scholarship amount was provided to support the higher education of 8 students who have completed their school-level  education from Kalikot district.The commercial bank is currently serving lakhs of its customers through its widest banking network of 192 branches, 193 ATM outlets, 4 extension counters and branchless banking locations each. The bank has raised a huge deposit collection of Rs 130 arba so far and disbursed the loans of Rs 106 arba.","('NICA', 'NEPSE')"
"April 8, 2018",http://archive.sharesansar.com/sunrise-bank-inaugurates-two-new-branches-at-rautahat-and-jumla/,Sunrise Bank inaugurates two new branches at Rautahat and Jumla,"Sunrise Bank has inaugurated two new branches at Durga Bhagwati, Rautahat and Guthi chaur, Jumla.With the inauguration of two new branches, Sunrise bank is currently facilitating its customers via 78 branches, 95 ATM, 20 branchless banking outlets and 3 extension counters. Similar, the Merchant Banking and Investment Banking functions are performed by bank’s subsidiary Sunrise Capital Limited.","('NICA', 'NEPSE')"
"April 6, 2018",http://archive.sharesansar.com/know-the-cutoff-price-of-auctioned-shangrila-development-bank-promoter-and-ordinary-shares/,Know the cutoff price of auctioned Shangrila Development Bank promoter and ordinary shares,"The cutoff price for auctioned 5,09,225 unit ordinary shares of Shangrila Development Bank Limited (SADBL) is likely to stand at Rs 142. The bids were opened today at Prabhu Capital Limited premises, and Rs 142 was informed to be the preliminary cutoff price.Out of total 1225 applicants, only 320 applicants will get the auctioned shares. Maximum bid price for the ordinary share stood at Rs 200. Siddhartha Equity Fund had bid for 50,000 ordinary shares at Rs 142, while Siddhartha Equity Oriented Scheme had bid for 50,000 shares at Rs 132. JSK Nepal Investment Pvt Ltd. bid for 44,656 shares for Rs 131, but its application was rejected since it applied for odd kitta (not divisible by 10). Birendra Bahadur Shah bid for 1 lakh kitta at Rs 127. Kriti Capital got hold of 2,000 shares for Rs 149.51.Similarly, the preliminary cutoff price for the auctioned 3,92,772.50 units promoter shares stood at Rs 105. There was a demand from 71 applicants for promoter shares. Maximum bid price for promoter shares stood at Rs 156.SADBL had auctioned the shares from Chaitra 13 to Chaitra 20, 2074 after all of its right shares were not claimed by its shareholders. SADBL had issued 10:8 right shares from Poush 17 to Magh 29, 2074.The current paid-up capital of SADBL is Rs 1.35 arba. After the issuance of right share, its paid-up capital will reach Rs 2.44 arba.The last trading price of SADBL stood at Rs 173 as of yesterday (Chaitra 23, 2074).","('ADBL', 'NEPSE')"
"April 6, 2018",http://archive.sharesansar.com/securities-board-of-nepal-has-added-9-90-lakh-unit-shares-of-himalaya-urja-bikas-company-in-the-ipo-pipeline-ipo-for-the-local-residents-of-ramechhap-district/,Securities Board of Nepal has added 9.90 lakh unit shares of Himalaya Urja Bikas Company in the IPO pipeline; IPO for the local residents of Ramechhap district,"The board has added 9.90 lakh unit shares at Rs 100 per unit on Chaitra 21, 2074. The project is based in Ramechhap district, so the IPO will be issued for the local of the project affected area.Nabil Investment Banking Limited is the issue manager for the IPO issuance.The authorized capital of the Company is NRs.99 crore & issued capital is Nrs.47 crore.  It was converted into public limited company on 17th Kartik, 2071.","('ADBL', 'NEPSE')"
"April 6, 2018",http://archive.sharesansar.com/samata-microfinance-bittiya-sansthas-50-right-shares-worth-rs-1-89-crore-added-in-the-right-share-pipeline/,Samata Microfinance Bittiya Sanstha’s 50% right shares worth Rs 1.89 crore added in the right share pipeline,"The 50% right share of Samata Microfinance Bittiya Sanstha Limited has been added in the right pipeline by the Securities Board of Nepal on Chaitra 13, 2074.The board has added 1.89 lakh unit shares of the microfinance worth Rs 1.89 crore.NIBL ACE Capital Limited has been appointed as the issue manager for the right share issue.Its paid up capital remains at Rs 3.79 (including 20% bonus shares from the net profit of FY 2073/74) crore with reserve of Rs1.42 crore in Q2. After the adjustment of 50% right shares its paid up capital will stand at Rs 5.68 crore. ","('NIB', 'NEPSE')"
